{
  "$schema": "https://raw.githubusercontent.com/HerbertHe/open-agent-team/main/schema/v1.json",
  "model": "default",
  "models": {
    "default": "openai/gpt-4o-mini"
  },
  "providers": {
    "openai": {
      "compatible_type": "openai",
      "base_url": "https://api.openai.com/v1",
      "api_key": "sk-xxx"
    }
  },
  "budgetExecution": {
    "enabled": false,
    "mode": "shadow"
  },
  "memory": {
    "enabled": true,
    "roles": ["admin", "leader", "worker"],
    "l1": { "maxItems": 24, "completedTaskTtlHours": 48 },
    "l2": { "maxResults": 5, "retentionDays": 180 },
    "l3": { "maxPromptItems": 5, "minEvidence": 2 },
    "lifecycle": {
      "dailyRetentionDays": 90,
      "dailyMaxItemsPerAgent": 5000,
      "completedScratchpadRetentionDays": 30,
      "candidateRetentionDays": 90,
      "candidateMaxItemsPerAgent": 500
    },
    "dream": {
      "enabled": true,
      "idleAfterSeconds": 300,
      "pollSeconds": 30,
      "maxEventsPerRun": 250,
      "cancelOnNewTask": true
    }
  },
  "knowledge": {
    "enabled": true,
    "roots": {
      "project": "knowledge/project",
      "teams": "knowledge/teams",
      "uploads": "knowledge/uploads"
    },
    "watcher": { "enabled": true, "debounceMs": 1000 },
    "ingestion": { "maxFileSizeMb": 50, "chunkTokens": 1000, "chunkOverlapTokens": 120 }
  },
  "project": {
    "name": "open-agent-team-demo",
    "repo": ".",
    "base_branch": "main"
  },
  "runtime": {
    "mode": "docker",
    "docker": {
      "image": "node:22-bookworm",
      "network": "bridge",
      "extra_args": ["--cpus=2", "--memory=4g"]
    },
    "persistence": {
      "state_dir": ".oat/state"
    }
  },
  "workspace": {
    "provider": "worktree",
    "root_dir": "workspaces",
    "git": {
      "remote": "origin",
      "user_name": "Open Agent Team Admin",
      "user_email": "admin@example.com",
      "push_enabled": false,
      "lfs": "pull"
    },
    "sparse_checkout": {
      "enabled": true
    }
  },
  "admin": {
    "name": "admin",
    "description": "Project manager responsible for global coordination and final delivery summary.",
    "prompt": "You are the Admin agent.\nCoordinate team leads, track overall progress, and produce the final delivery summary.",
    "skills": []
  },
  "teams": [
    {
      "name": "platform",
      "branch_prefix": "team/platform",
      "leader": {
        "name": "platform-lead",
        "description": "Platform lead responsible for task decomposition and worker coordination.",
        "prompt": "You are the Leader agent for the platform team.\nDispatch only genuinely independent implementation tasks.\nReview every Worker submit-review request before merging it into your integration branch, then submit a release proposal for Admin approval.",
        "skills": [],
        "repos": [
          "src/",
          "package.json"
        ]
      },
      "worker": {
        "total": 3,
        "prompt": "You are a Worker engineer.\nImplement and self-test your assigned task in its task branch, update CHANGELOG.md as delivery evidence,\nthen call submit-review with test evidence. Never merge your own branch.",
        "extra_skills": [],
        "skill_sync": "inherit_and_inject_on_spawn"
      }
    }
  ]
}
